,title,selftext,comments,subreddit,created_utc
1euwetl,Shields will be splintered ,"So I found a rule a while ago that said something along the lines of if your character has a shield then that player could choose to have their shield destroyed by in incoming attack to have that attack do no damage. 

I started using it and low level fighters and clerics now have at least 2 good hits in them (exactly 2 since I use a hd system) and I just thought I’d ask if anyone else using a similar ruling for their games?

Maybe it will get old fast? I can see why they used to hire a kid to haul all your crap around….",<praw.models.comment_forest.CommentForest object at 0x2b6530770>,osr,1723941014.0
1gvu780,Non-Tolkienesque Non-Gonzo settings,"Hello everyone! I'm looking for suggestions on mid to low fantasy settings that meshes well with OSR style of play, and that avoid tolkienesque races such as orcs, elves and dwarves, but that also doesn't fall into the gonzo ""Cavemen fighting dinosaurs with lasers"" types of settings. I'm familiar with the pulp classic settings such as the Hyborian Age, or Elric's world, as well as a few dark fantasy settings such as the world of Mörk Borg.

Anyway thanks in advance! ",<praw.models.comment_forest.CommentForest object at 0x2b6557440>,osr,1732121959.0
1dt620q,"Whats your ""everything"" OSR game?","I'm preparing to run my first OSR game (B/X), and while it seems great, it also seems pretty specialized for dungeons. Do you have a particular game you use for most things?",<praw.models.comment_forest.CommentForest object at 0x2b659c650>,osr,1719873017.0
1b59yjh,Weekly OSR Vlog/Blogroll Round UP!,"(Big credit to r/xaosseed, r/sofinho, and r/shuttered_room for all their fantastic work doing these posts manually before we automated it.)

The [r/osr](https://www.reddit.com/r/osr/) weekly blogroll.

Hey there! There's been an update regarding where we can post your blogs. Starting from 5/14/2023, you are no longer required to post your blogs solely on this roundup. We hope this update is helpful for you and your blogging journey. Feel free to let the mod team know if you have any questions or need any more help! 

Share your sparks of inspiration below!",<praw.models.comment_forest.CommentForest object at 0x2b660aea0>,osr,1709445673.0
1bg4o84,How did YOU get into the OSR?,"The question explains itself really. But sonce this is a relatively obscure community inside an already niche hobby, I was curoius anout y'all.

Are you a true grognard that has been playing since 1e? Have you fleed to OSE or similar games after the OGL debacle? Or did you take an entirely different route?

For me, it was... this very subreddit, Back when I DM for 5e, all the best GMing tips came from here, and after a quick Google search, a whole new way to play RPGs unfolded before my eyes.

So, let me know!",<praw.models.comment_forest.CommentForest object at 0x2b6654f20>,osr,1710591109.0
1ims2l0,OSE isn’t really that difficult,"Not sure how it gets this reputation. 

I’ve been running my first OSE campaign for awhile now and sure… level 1 and 2 can be pretty sketchy, but once the players get a few levels and have a decent amount of HP alongside a collection of magic items and scrolls and potions, it’s really not that deadly.  Survivability goes way up.

Unless they’re fighting some crazy deadly monster that is",<praw.models.comment_forest.CommentForest object at 0x2b6670050>,osr,1739254170.0
191oydk,"in 2024, what OSR products would you like to see?","honestly, if more people would delve into high fantasy for setting it'd be dope. also, more dungeons, like in volume, just a whole bunch of short-ish delves for one-shots.

whatever they do: for the love of god make the e-books in single column format for people like me who like to read on their cellphones/tablets. i say this every year though...

what about you guys? what do you want to see from OSR in 2024?",<praw.models.comment_forest.CommentForest object at 0x2b66d9fa0>,osr,1704730897.0
1ei8bif,I don't get OSR. Help? ,"I was born in 5th edition, and have been relentlessly branching out since the OGL situation last January. 

I haven't read an osr book yet, but I have skimmed through some quick starts and Kickstart demos. 

When I sit down to *read* them, I just feel lost. 

Here's what I have, please correct me if I'm wrong:

You're usually rolling a d20+mod, aiming higher than a target number. Characters have basically no HP, and are created by rolling on a table. The author's aren't going to make a rule for every situation, the GM is going to make rulings instead. 

Gameplay should be fast. We're not spending time looking up rules. We're going to adjudicate and move on to the storytelling. Kick in the door. Kill the monsters. Loot. Repeat. 

Help?

**Edit** This is awesome. Thank you for the feedback, folks.

Updated understanding: You're not special, you're Indiana Jones instead of Jason Borne (which is not to mention Captain America, who is comparatively off the charts). So this isn't ""heroic fantasy"" as much as it's ""exploring dangerous spaces fantasy."" And at the end of the day, Indy still has a mortgage, so he finds ancient dungeons, sneaks his way through, grabs stuff, says ""this belongs in a museum"" and then sells it to the museum. ",<praw.models.comment_forest.CommentForest object at 0x2b6714080>,osr,1722600270.0
1ixd9yu,How is the OSR experience at higher levels?,"I've only had the chance to play OSR-style dungeons at low levels, where survival is a constant struggle, and every encounter feels like a potential death sentence. I'm curious—how does the experience change at higher levels?

Does lethality decrease as characters become more powerful, or do the threats scale in a way that keeps things just as deadly? What kind of challenges do higher-level parties typically face? Do dungeons become more about puzzles, resource management, or political maneuvering rather than just avoiding instant death?

Would love to hear from those who have played long campaigns or reached higher levels in OSR games!",<praw.models.comment_forest.CommentForest object at 0x2b672a6c0>,osr,1740431851.0
1hopr3l,What is your favourite style of gaining XP?,"Milestone XP? Monster XP? XP for gold? XP for deeds or quests? Something not mentioned?  All of the above?

What is your favourite style of XP gain and why?",<praw.models.comment_forest.CommentForest object at 0x2b6754e90>,osr,1735452528.0
1b2pq7t,"The irony of ""3d6, in order"" as an OSR mantra...","...is that even Gygax wasn't in favor of it (AD&D DMG p 11, he flat out recommends other methods, like 4d6, drop the lowest, choose order). Hell, even Moldvay Basic allows moving points between attributes (to a limited extent). ",<praw.models.comment_forest.CommentForest object at 0x2b67a9910>,osr,1709175606.0
1hpd63b,Wondering how these changes would influence my OSE game,"EDIT: Not sure why this post is getting downvoted. I am a newbie to this space asking a genuine question. I appreciate the responses a lot, but find the hostility baffling.


I’m about to start running my first OSE campaign for a school club, and stoked for it. There are three changes I am planning to make that might mess up the balance and wanted to ask what the unintended effects of these might be. For the record I’m planning to start with some old school 1e modules, and build out to a blend of TSR modules, OSR stuff and homebrew. It will be a Greyhawk campaign set in the Dim Forest area.



Change #1 - Partially replacing GP leveling with objective leveling.

I get the rationale behind GP leveling but I have two concerns about it. First, that instead of incentivizing murder hobo behavior it incentivized kleptomania. I want my players to actually form meaningful alliances with NPC factions, not just get their guard down so they can loot their horde. 

Second, it’s just too much math. The reason I’m leaving 5e is because I want less math, not more. 

5e milestone leveling is an outstanding system that disincentivizes combat, but doesn’t work with a non linear OSR type game. Objective leveling does work.

Let’s say I give a flat amount of points for certain objectives. Overcoming (through any means) a random encounter = 100 points. Overcoming a major hostile NPC = 500 points. Clearing an entire adventure module = 1000 points. Something like that. Points received scale up with level.



Change #2 - Removing demihuman level restrictions, EDIT: adding the human racial bonuses included in the OSE Advanced rule book, but keeping class restrictions.

Again, I have two issues with the level restrictions. First, if you hit the level cap it just feels REALLY bad. Second, if you don’t hit the level cap (a more likely scenario), humans remain the weakest race.

The class restrictions are great, though. They give each race identity. The optional rule says that I can remove level and class but not level or class. Therefore removing level restrictions but not class restrictions is going off script. What effect would that have? At a glance it seems to make humans somewhat overpowered while making Half Elves and Half Orcs extremely underpowered.



Change #3 - Removing encumbrance 

Somehow this feels like simultaneously the most controversial and least controversial idea mentioned here. Again, the idea is to cut down on math and maximize playtime. My PCs are played by teenagers who won’t do that math anyway and I damn well won’t do it for them. Getting them to track their rations and roleplay solutions will be hard enough. I do note that encumbrance is an optional rule in OSE but I also know removing any tracked resource from a game like this is a recipe for breaking the game.



TL;DR - I want to use an OSR-ized form of milestone leveling, remove level restrictions but NOT class restrictions, and ignore encumbrance. How badly will this break my game?",<praw.models.comment_forest.CommentForest object at 0x2b67d8b00>,osr,1735527059.0
1i62dx5,OSR Shift from Advanced to Basic?,"Back when I got connected with the OSR in 2009 or so, it seemed like almost everything was focused on AD&D and its derivatives (e.g. OSRIC). I was mostly on Dragonsfoot back in those days.

I'm just getting back into it after ~12 years of not playing, and it seems like the OSR is very focused on Basic D&D and successors nowadays. When did this change happen? What caused it?",<praw.models.comment_forest.CommentForest object at 0x2b67f00e0>,osr,1737410385.0
1h6k72e,Rerolling ALL HP at every level?,"I have been playing at a table for about a year where the GM lets you reroll ALL of your HP at every level. This was the first I had ever heard of that rule and I was shocked because this is in an OSR-type of game. And then elsewhere in this sub-Reddit today, I saw people talking about that HP rule as a quality-of-life improvement for OSR games and getting a great deal of support for that view. 

I’m just really surprised because it seems really anti-OSR to me. I thought part of the ethos was that you kind of “get what you get” and make the most of it – plan accordingly knowing that your character has relatively few HP, for example. 

I’m just wondering what some of the general thoughts are on this. 

I guess part of it comes down to how resilient one wants the characters to be and a general sense of “fairness,” but it just seems to go against everything I associate with the OSR and the way I played these games growing up. 

I guess I wouldn’t mind a system that said “we want characters to be more resilient, therefore we will have the following rule in play:” but for that rule NOT to be that you reroll all of the HP every level (if you want). Like maybe, after you level, you reroll a 1 or a 1 or 2 for d6+ hit die classes. I would be more okay with that, than letting a player reroll all HP every level. 

I guess this thing triggered me :-)

UPDATE: r/OnslaughtSix told me that the OD&D table he plays at told him that rerolling HP at every level is “a valid reading of the way it’s phrased in OD&D.” After looking at a PDF of OD&D, he’s right. The rules there just state how many “hit dice” a character gets at each level. And if you look at the language there, and the character charts, it actually looks more like one SHOULD be rerolling them at every level by that rule. 

While I have said a lot about letting dice rolls count and I still would prefer not to have a character go up more than a hit die (+ any bonus) of HP from leveling, I also like tradition and don’t mind unusual things that come out of it. So I am much more comfortable now with these types of rules.

 ",<praw.models.comment_forest.CommentForest object at 0x2b7024cb0>,osr,1733329664.0
1arugcm,I've never truly enjoyed 5e.my group is tired of wotc but sees themselves playing 5e forever. How do I get them interested in osr?,"I've had some really great times playing 5e over the years, but frankly it was always in spite of the system. I don't enjoy arguing over wordings of rules, or being pigeonholed into a track I can't get off of when I'm tired of it. I've recently been in the process of starting my first campaign as a DM and I've been focusing on all of the under developed aspects of the game. I'm trying to tie gold to xp, and using loot tables for magic items. Many osr systems already have the systems Im basically building from scratch. I'm hoping this game will get them into the idea of building a keep, hiring minions and pursuing their own goals, but how do I get them to switch away from 5e?

Edit: thanks for all the responses! I thought this would get down voted to oblivion. Instead I've gotten some great advice and some system suggestions for people with experience playing them",<praw.models.comment_forest.CommentForest object at 0x2b7094fb0>,osr,1708041755.0
15bvhe3,What drove you to Old-school?,"This is just a framing device for me to share why i did it, but i want to know about the ""5e generation"" that came to the OSR like me and the OG guys from the 70's.

I realized i had a very weird game i wanted to DM and i couldn't find a way to make my players buy into it. Had this inconveniences and focus on treasure and dungeon crawl and and excuse why magic was so weird and uncommon...

Now i just have to tell them ""i'm running and Old-school game"" xD  


Edit: Thanks for the responses so far. I was surprised to see how many people came to OS systems for similar reasons as me, even if i didn't word them the same. I felt like a weirdo for a long time for liking this kind of game, and finding out a place where it's ok to like it is very encouraging. I kinda had given up on the hobbie alltogether before i found out about OSR",<praw.models.comment_forest.CommentForest object at 0x2b71008f0>,osr,1690545661.0
1g3ushh,I attack and miss. Then they see the creature and it attacks and misses too. And now master? How do you deal with this at your tables?,"Today after listening to a podcast about ""taking away the attack roll"", which is a mechanic used in some systems. I was left with a point about this being perhaps motivated by possible solutions to eliminate — I attack, I make a mistake, the opponent attacks and makes a mistake. Then there are a series of errors. The famous blind fight that takes place at DND. In the end, I was wondering how much this really negatively influences the table. I don't remember this happening very often.   
  
And even so, I was thinking about ways to mitigate this, I was thinking about maybe giving a +1 bonus to the opponent after an attack misses, do you see this as a viable solution?   
  
I wanted to know your opinion on the topic. And also find out if you have already tried anything to reduce this at the table. If you think this is relevant or not, I would especially like to know what you do when this happens at your table.",<praw.models.comment_forest.CommentForest object at 0x2b7136db0>,osr,1728951060.0
1huwdnn,What do people do with all the money?,"Let's say that a character has amassed 20,000 XP, which is not an extreme amount of XP. And let's say about half of that comes from treasure (which is pretty low, if I understand correctly). That's still 10,000 gp. A fighter can buy the best (non-magical) armor and the best (non-magical) weapon and still have plenty over. No buying magical items - which is a good thing, I hate that about D&D 3rd edition - so what do adventurers do with all the money? Hookers and blow?",<praw.models.comment_forest.CommentForest object at 0x2b714f170>,osr,1736160632.0
1j8znbx,Clipping lanterns to belts,"For games set in typical medieval fantasy settings, would you allow lanterns to be clipped to a belt or another article of clothing? I think the normal assumption in OSR play is that you need a free hand to wield a light source so I wanted to see how other DMs ruled this.

I can imagine a few reasons why it wouldn't be common to do this IRL (I believe modern lanterns don't suffer these issues, but medieval lanterns might?):

* Being too close to the body could mess with the air intake, dimming the flame
* The heat generated may be too uncomfortable to stay clipped so close to the body for long
* The contents may slosh around too much, potentially accidentally dousing the flame

If none of the above are enough to outright prevent lanterns from being clipped, I would imagine that there's the possibilities that a fall or solid hit in combat could cause the lantern to shatter and the burning oil to damage the wielder",<praw.models.comment_forest.CommentForest object at 0x2b7165b50>,osr,1741722228.0
1drq1m2,"If you could only recommend one OSR system to a newb to OSR, which would it be and why?","If someone approached you wanting to learn about the OSR and was familiar with D&D (let's say they played a bit as a kid in the 80s or 90s and are now an adult), which set of rules would you suggest to them to look at, and why would you suggest that set of rules over the myriad of others?

You can only pick one!",<praw.models.comment_forest.CommentForest object at 0x2b71aec30>,osr,1719710146.0
1j4622a,What OSR Products Are You Looking For?,"There’s a huge amount of OSR stuff out there. What type of published products are you most interested in these days?

[View Poll](https://www.reddit.com/poll/1j4622a)",<praw.models.comment_forest.CommentForest object at 0x2b71ce150>,osr,1741189619.0
112trvb,Dolmenwood will be a standalone game,"Full blog here: [https://necroticgnome.com/blogs/news/dolmenwood-developments](https://necroticgnome.com/blogs/news/dolmenwood-developments)

It looks like the OGL nonsense was the final push; but I think it makes sense anyway. It has slowly drifted a little away from its B/X core anyway.

The Patreon is restarting, but only for a few months and it won't be open to new backers, although he might re-evaluate that.",<praw.models.comment_forest.CommentForest object at 0x2b726ddf0>,osr,1676452055.0
1iq7i57,Most elegant rules for light armour / no armour Fighters?,"In other words, rules that make it worth playing such a thing, ideally with some kind of plausible explanation.

Don’t get me wrong, I know that the classic OS / OSR Fighter is - as soon as they luck in and/or gather sufficient wealth, anyway - a heavy armour hefting beast.

On the other hand, there are plenty of old school - and of course many more recent - Fighter type characters in novels, TV & movies, comics & manga, and games, wearing light or no armour, by choice in fact.

If it‘s simply suboptimal (i.e., utterly pointless), rules-wise, very few players will opt for it, needless to say I suppose.

So, what’s the best solution you’ve come across, in terms of mechanics, and possibly explanation too? House rules / hacks absolutely welcome.",<praw.models.comment_forest.CommentForest object at 0x2b7280b60>,osr,1739643401.0
1ds9muq,what are your thoughts on full HD at 1st level?,"i really really like this house-rule, its the one ""modern"" house-rule i feel should always have been part of the original game. however, i don't normally see it being discussed much in here when people talk about lethality or HP and i've seen some discussions on hit dice earlier this week, so i want to know what is the sub's general consensus on this approach.",<praw.models.comment_forest.CommentForest object at 0x2b72c1a90>,osr,1719776404.0
1eznrwe,How deep does a world have to be?,"As a primarily 5e GM, I have grown extremely burnt out from the ""design a plot"" way of GMing that is common in 5e play culture. Going to the OSR, what excites me is to make a big sandbox open world game with a lot of things to explore. However, now I am wondering, how important is it that this world has deep lore, is unique/original etc, for the enjoyment of the players? I know mega dungeons exist, and those have lore but it's often more about the challenges and joy of exploring. 

Is it fine if I just plonk down some dungeons from a few modules, take ""generic fantasy"" as the setting, and just play? Is it important that everything is very well integrated? 
Perhaps this is lazy GMing, but I'd love to just play and have fun right now in a way that doesn't burn me out like much of prep has done in the past",<praw.models.comment_forest.CommentForest object at 0x2b72ee540>,osr,1724447086.0
1e83mo2,7 people just RSVP'd to your OSR game tomorrow morning... what are you running?,"Obviously my current situation lol. Players invited friends and the number's jumped from 3 to 7. Many of them have never played an RPG before. I'm excited and want everyone to have a good time.

What would you run?",<praw.models.comment_forest.CommentForest object at 0x2b7335fd0>,osr,1721504000.0
1frj2k8,Drawbacks to gold for exp? ,"I really enjoy the playstyle of gold for exp, but is there long term drawbacks to the system? ",<praw.models.comment_forest.CommentForest object at 0x2b7365d30>,osr,1727543495.0
1gmh9rw,Do you really need gun rules?,"Every OSR system that I checked with guns, got some rules for guns, but to me it just adds additional clunk. Like gun drawing rules, jamming, reloading and so on. 

I want to run a hexcrawl set in a post-apocalyptic world, with magic and sci-fi technologies. I thought, having guns seemed very logical to me, and everyone would use one. There is no real reason, not to reflavour bows to guns, in my opinion. And bows seem limiting, as you cannot do much with bows, but guns? You can have all sorts of guns, wacky pistols, 6-barreled shotguns, hand cannons (like from Serious Sam) and so on. 

So my idea was just reflavour bows to guns, not giving them additional damage by default, making tweaks case by case and just run the game. Anyone done that before?",<praw.models.comment_forest.CommentForest object at 0x2b738c830>,osr,1731068599.0
