,title,selftext,comments,subreddit,created_utc
1irszg3,I really don't understand why Glumdark is on top of the Kickstarter charts right now. In defense of system-specific and offense of system-agnostic random tables.,">A massive, fully illustrated, painstakingly constructed resource for Game Masters and players of dark fantasy tabletop roleplaying games. Recommended for the likes of Mörk Borg but totally system agnostic and compatible with Shadowdark, Dungeons and Dragons, Pathfinder, or any other TTRPG.

It claims to be system agnostic, which is theoretically true, however the reason why people play Shadowdark over Mörk Borg or Pathfinder over D&D is because these **systems are tools to tell particular type of fiction.**

For example, D&D 5e is largely a game about heroic roleplay where characters brave social, exploration and combat encounters with their bespoke talents. Therefore DMs will tend to run encounters that engage with the PCs character systems. Therefore to maximize fun in those systems, the GM needs to engage with those rules, or else the players end up with a whole bunch of buttons that do nothing.

And 5e, unbeknownst to most of you, I'm sure, has bespoke random tables!

|1d20|Situation|
|:-|:-|
|1|A dragon wyrmling has gathered a band of kobolds to help it amass a hoard.|
|2|Wererats living in a city's sewers plot to take control of the governing council.|
|3|Bandit activity signals efforts to revive an evil cult long ago driven from the region.|

A small snip of the DMG (please don't Pinkerton me, WotC). As you can see Adventure Starters in 5E do a couple things. They set up a situation where players solve a problem through any combination of social, combat encounters and a place to explore. This isn't random design, the table is written that way because of the way 5e, as a game, works. It also references settings and monsters, because those monsters aren't just statblocks, they mean things. Dragons and Kobolds have very distinct roles in the meta-setting of modern D&D.

The players are playing to achieve and overcome conflict.  
  
Mörk Borg is a rules light game driven largely by its setting, which is interlinked with its mechanics to create tone and atmosphere. Mörk Borg mechanics, despite being relatively rules-light, is inextricably linked with its setting. If you ignore The Calendar of Nechrubel, most of the other game elements fall flat. If the world doesn't end, what's the point of the Basilisks under Galgenbeck? If nobody believes the prophecies, then why is the world such a dark place? If characters aren't meant to be fairly disposable, then why do they die so quickly?

https://preview.redd.it/bgj2mfiyzqje1.png?width=479&format=png&auto=webp&s=06d4457949df9733bbf6a68216211a13dda82ef9

As you can see, the contents of the table are definitely not system or setting agnostic and build upon the Mörk Borg setting. They also don't seed for encounters, like most OSR games, it is leaving space for emergent storytelling. The players are playing to find out.

You see, while these tables are random, the content is still bespoke for the game and build upon its mechanics and tone.

But here is a Glumdark Table for Quest Seeds example:

1 You meet a hedge wizard who is the victim of a terrible curse. They want you to do some exploring for them. Head to the Covered Waterfall and see if you can find a rumored cache of goods.  
2 Guard the warden Oto Potocnik on their journey to the Blasted Ocean.  
3 The cleric Teja Pohl needs you to seize the Quill of Rats from the Roost of Contemplation.

1. You meet magical dude with nondescript condition. They want you to go dungeon crawl at nondescript place. The dungeon crawl has nondescript loot maybe.  
2. Escort a dude with interesting yet nondescript job title to evocatively named yet nondescript place.  
3. Dude with interesting job needs you to dungeon crawl to find evocatively named thing.

Like I am not crazy right, but running these in either 5E or MB seems very attractive. Evocatively named things have to be made up retroactively to fit the setting or content has to be added through GM fiat.

What difference does it make if I go to the Blasted Ocean over the Covered Waterfall? Neither these places are real or even loosely defined. There is no restriction, which could breed creativity.

Like random tables are fun tools because you point you into a direction, but rather Glumdark is just spits out a sequence of words you have to assign directions to.

https://preview.redd.it/zjoxbgqz5rje1.png?width=645&format=png&auto=webp&s=ba38a19343ef1e5f47b3555e42b42472bac75345

Like what do I do with this? Hello Player, you receive a grim bullwhip of throat-punching? What does it do? How does it relate to the world the rules have laid out? What makes it weird? How does that weirdness manifest mechanically?

At that point I am not consulting a random table, but just creating homebrew with a random dark sounding title, which doesn't make the DM's job any easier.

So honestly while it does seem nice that Glumdark is system-agnostic, I can't help but feel that they might have shot themselves in the foot by being too general and just end up with a ""grim fantasy wacky words"" table, rather than a helpful and opinionated tool for DMs.

Am I crazy? Am I the only one who thinks like this? Many thanks for reading if you have made it this far.",<praw.models.comment_forest.CommentForest object at 0x2b25d9580>,osr,1739821894.0
1jebdlv,Swords & Wizardry…who’s running it?,"In an OSR world where many systems are discussed very often, I don’t hear many people talking about Swords & Wizardry these days. Are any of you running it these days? Are you using the latest version? Are you using any of the new supplements for it?",<praw.models.comment_forest.CommentForest object at 0x2b2600500>,osr,1742320905.0
1ikspdx,Are Adventurers/PCs in Old School (0e-2e) and OSR games supposed to be social deviants?,"I've been thinking a lot of what type of play and what kind of characters the 3e-5.5e games encourage. It seems like a lot of modules basically encourage players being good and heroic do-gooders in a society where adventuring is generally socially accepted the same way going to college is considered a ""good thing"".

However in old school games, the adventurers tend to start out as extremely weak peasants looking for glory, despite just one pit trap away from certain death. Usually those dungeons aren't cleared to save the world, but just because treasures wait inside. So unless the PCs are exceptionally greedy and thrill-seeking or desperate for money, this would be extremely irresponsible behavior with poor RoI in any medieval agricultural society.

I would therefore argue that in Old School games, the PCs start out as ""low-life"" characters and glory seekers, which is in stark contrast to how the PCs are socially perceived in Modern D&D.

Would you agree? Or am I totally off-base in this assumption?",<praw.models.comment_forest.CommentForest object at 0x2b263b0b0>,osr,1739036125.0
1fvd9ng,Is there a half-point between OSR games and something more modern? Can you recommend me a game like that?,"I have read or am in the process of reading several OSR games and I'm really charmed by this kind of old school games (even if they are new). But I'm somewhat taken aback by how little structure it has to support the DM, or in other words, how much work it loads in the back of the DM.

More specifically, what I'm looking for, is a game that has a midpoint between those two concepts.

That is simple, elegan, short, quick to learn, gives creative freedom... and its also, somewhat detailled, full of tools and ideas for the DM, offers a framework for DM fiat, decision making, rulings, and basically, the DM job.",<praw.models.comment_forest.CommentForest object at 0x2b26999a0>,osr,1727976705.0
1gyx163,How do y'all convince 5E players to give OSR a try?,"I run a D&D campaign and whenever I try to sell my players on trying OSR games (OSE, MorK BORG, DCC) they hate how it sounds. I mention some highlights like; rules light, open ended and more of a challenge. But they all do not like the idea of not having a huge character sheet with their abilities spelled out for them. Ive tried to show the, that they have actually more options since its up to them and their imagination. No such luck. ",<praw.models.comment_forest.CommentForest object at 0x2b26db5f0>,osr,1732470994.0
13b564d,ShadowDark,"Before I begin I will preface this by saying:

Kelsey Dionne has not asked the mod team (nor has she paid us) to say this. She has been quietly responding to every allegation herself and Im embarrassed.

I’m embarrassed that our normally welcoming community has been hostile and abrasive to her creation; attributing her success to paying off talking heads for good reviews and not her hard work.

Ben Milton has been paid to review ShadowDark, he is the sole person who has been paid to review ShadowDark.

We should be celebrating the success of an OSR inspired game in hopes that it brings more traction to our niche corner of the hobby instead of acting like jealous children.

I don’t want to have to enforce this but conspiracy theorists will be looking at harsher punishments for future allegations.

This will not be added to the rules as I hope this will be the end of the issue.",<praw.models.comment_forest.CommentForest object at 0x2b2780470>,osr,1683498652.0
1gqjvbs,This sums why I prefer the culture of OSR play,"This poll for if you want super human martial characters. I voted realistic and that I prefer playing martial characters. I like realistic folks, with magic weapons and such making them badass, not that they are The Avengers so something.

[https://www.reddit.com/r/dndnext/comments/1gq12h4/how\_do\_you\_like\_martials\_in\_dnd/](https://www.reddit.com/r/dndnext/comments/1gq12h4/how_do_you_like_martials_in_dnd/)

The results of this has nothing to do with rules, but the culture of the players, the vast majority of 5e players want super heroes and the creators will then make content for their audience. ",<praw.models.comment_forest.CommentForest object at 0x2b27cf770>,osr,1731522714.0
1d5uzix,Knave 2e disappointment? Other opinions?,"Just got Knave 2e physical book in the mail. The hardcover quality is good and the artwork by Peter Mullen is awesome!

I'm quite disappointed with the rules and content though . . . it seems so, I don't know, half-finished? Not play tested? It's hard to say but it seems like the content was just kind of mashed together without much thought.

A lot of the random tables seem like they were glued in to pad the page count  without any real context or explanation of how/when to use them. I know it's subjective but the entries aren't particularly inspiring to me either. I understand that it's  a matter of taste but it seems like ChatGPT could give me a similar list of 100 different types of fabric, etc . . . nothing is particularly novel or creative.

Some of the rules seem pretty half-baked, too. The number of encounter rolls per day using the hazard dice and the ration depletion seems off. The relic magic was very disappointing: basically just telling me as the GM to make something up by myself.

I loved the first version of Knave: so much value and play was crammed in 7 pages! I played the hell out of it! Just wondering what others' thoughts on Knave 2e are. I wanted to love this game . . . it was going to be my go to system but now I'm regretting the money I spent. Maybe I'm missing something?

Curious what others are thinking of Knave 2e . . .

EDIT:

I want to thank everyone for sharing their opinions! I think I came into the Kickstarter with the wrong expectations. The book and art are beautiful and I'm glad that many folks are having a great time with it at their table. I'll admit to not having played it yet and will give it a test drive in a dungeon. Good gaming all!

  
UPDATE (2 months later):

I took the advice of some of the folks in this thread and gave Knave 2e a solo spin in some dungeons. I used the new OSE Anthologies to play ""The Jeweler's Sanctum"" and ""Curse of the Maggot God"" using the Knave 2e rules. I had an alright time of it. Thanks to those who suggested I get more information and real experience with the rules. 

Knave 2e will not be my 'go to' system but I wanted to share my hopefully more balanced and informed experience below to be fair. Thanks again to all who commented to agree or disagree. 

  
POSITIVES IMO

+ Character creation: 

(a) I found a few tables that helped me create some interesting looking Knaves that were interesting and fun. But I had to go to the NPC section for this . . . 

+ Rules: 

(a) The rules translated well to the OSE dungeons and stats. It was quick and easy to resolve encounters. 

(b) The rules didn't require much in the way of conversion. I just used the AC stats in the module as written. Same as Knave 1e this was good. 

+ Encounters: 

(a) I used the overloaded dice and it was okay in the dungeon crawl. I had to ignore a couple of rolls for consecutive burnt torches. It wasn't that bad. The dungeons had their own 'shift' tables built into the random encounter tables so I used those for dungeon shifts. 

NEGATIVES IMO

- Character creation: 

(a) I didn't really prefer the 'careers' and their items. I traded most out for other stuff and it seemed weird rolling two often very disconnected backgrounds. 

(b) Still really not a fan of Relic magic. I love the idea but I didn't find the tables helpful enough in creating relics and Gods. The results were strange and hard to bind together into something workable and fun.

(c) Traveling to the NPC section for character details was a hassle. But that was my choice to spice up the characters to make cartoon sketches so not Knave 2e's problem.

- Encounters: 

(a) I tried using the random tables for dungeon shifts and they were really weird results that I would have struggled to use in the module as written. Thankfully these particular modules had 'shifts' that were written in so I used those instead.

",<praw.models.comment_forest.CommentForest object at 0x2b2934620>,osr,1717270778.0
1g5no6w,Why is DCC so loved and so hated by the community? ,I see people talking so well about DCC and others so badly. I would like to understand the reason for different opinions.,<praw.models.comment_forest.CommentForest object at 0x2b2990b90>,osr,1729160646.0
1hx1lub,Shadowdark or OSE?,I'm thinkin about makin a long term west marches hexcrawl styled campaign. I've never played any of the systems and both seem very interesting. Do you guys have any opinion about these systems on a campaign like that? ,<praw.models.comment_forest.CommentForest object at 0x2b29c3470>,osr,1736387876.0
1f2x9ep,D&D 5.5's Starter Set Will be the Keep on the Borderlands,"Thoughts? Teaching new Kids old School design or will it be terrible like... everything Wizards has put out recently?

https://comicbook.com/gaming/news/dungeons-dragons-returns-to-forgotten-realms-in-2025/",<praw.models.comment_forest.CommentForest object at 0x2b2a12870>,osr,1724806171.0
1hrhe29,What TTRPGs would you like to see at a gaming store besides D&D,"I have a friend who owns a gaming store and I have been writing a list of different TTRPGs beyond the usual stuff. The difference is I'd like to show other gaming systems to beginners and veterans of role playing that there are other options. So far I have stuff like Mörk borg, Hyperborea, OSE, and modules/campaigns like Barrowmaze. What are some systems, modules, and campaigns like books you'd like to see and why?",<praw.models.comment_forest.CommentForest object at 0x2b2a56c00>,osr,1735779018.0
1fb525d,Movies for OSR inspiration ,"What movies give you OSR vibes? I'm thinking Indiana Jones and Conan movies, but I'm curious if there are other good films about dangerous dungeon delving.",<praw.models.comment_forest.CommentForest object at 0x2b2aab500>,osr,1725709634.0
11l514k,OSR theory vs reality,"My background: Started playing D&D in 1979 with the Holmes blue box. Played regularly ever since. Witnessed the genesis and growth of the old-school renaissance movement on various forums since it started more than 15 years ago, and participated in many discussions about what made early D&D different from what came later.

And I’m here to tell you that dogma like ‘combat is a fail state in old-school D&D’ is revisionist nonsense. And the fact it gets bandied around so often is proof that the reality of how people played D&D 40 years ago has been eclipsed by theory-craft.

By the time AD&D was published, the great majority of gamers employed a mix of published and home-brew adventures. Adventures like Steading of the Hill Giant Chief, White Plume Mountain, Keep on the Borderlands, and Village of Hommlet flew off the shelves. None of these are mega-dungeons. None of them present a premise of sneaking into a dungeon and liberating it of treasure without alerting the inhabitants. In some cases, putting the inhabitants to the sword to remove a threat to civilization is the whole point of the adventure (G1, the Caves of Chaos). In others (White Plume, Hommlet, the Tower of Zenopus), the scope and layout of the dungeon does not enable the stealthy circumvention of threats.

No, when the party rolled up to the entrance of those dungeons, they were on a search a destroy missions to kill the monsters and take their stuff. Did they use deception and cunning tricks to shift the odds in their favour? Absolutely. Did they retreat from combat when they realized they were in over the heads? For sure. Did many PCs die out of bad play or bad luck? Yep.

But what they did not do is treat combat as a fail state. Rolling dice and killing monsters was the heart of the game, and the default premise of these hugely popular adventures - adventures that taught new players what D&D was about. How Gygax and a few other OGs played in 1975 was already irrelevant to the player-base by 1979. How would we have even known how Castle Greyhawk was run?

It’s cool that the OSR revived old and forgotten play modes and principles. I was part of that early dialogue, when we shared stories of desperate struggles to survive the Caverns of Thracia, or the six-level meatgrinder of a dungeon that our DM in grade 10 made over summer break. And how those experiences contrasted with the heroic, super-powered assumptions of 3.X D&D.

But the message has become garbled and distorted on forums like this, often by people who didn’t play 30+ years ago. Now they’re preaching and enforcing an orthodoxy that would have been absolutely baffling to a bunch of 15 year olds chucking dice in a rec room in the 80s.

Tldr: The OSR principles that get bandied on forums like this are not reflective of how the great majority of people played D&D in the first decade of its publication. They were crafted and championed with the aim of reviving a very narrow approach to play that was - until recently - not widely adopted or even known about.",<praw.models.comment_forest.CommentForest object at 0x2b2b234d0>,osr,1678209088.0
1howqfw,Low-Fantasy Movies for OSR inspiration?,"There was a thread a long while ago on sword-and-sorcery movies that look/feel like OSR narratives. I'd like to pose a similar question: what are some low-fantasy/historical adventure movies that you think feel like an OSR adventure?

I'll put forth two proposals to start, all Italian movies: *For Love and Gold*, 1966 and *Soldier of Fortune* \- 1976.

So, what are your favorites?",<praw.models.comment_forest.CommentForest object at 0x2b2b4e300>,osr,1735481393.0
1icagv6,What do you think are the most commonly misunderstood OSR phrases or sayings?,"A while back I saw two people arguing about the advice from Matt Finch's primer, such as ""Rulings, not Rules"" and ""Forget 'Game Balance'"". While the primer itself follows these saying with blocks of explanatory text, out in the wild they're often just dropped as ancillary shorthand. The particular argument I saw was based on reading the ""zen moments"" of the primer as a reaction to D&D3e rather than as a set of novel statements; that ""Rulings not Rules"" means a DM should be able to use rules for intuitive results rather than that detailed rules are to be avoided, and that ""forget game balance"" means players should sometimes be faced with challenges which must be worked around or avoided rather than the idea of a ""balanced encounter"" itself being anathema to the game.

What are other sayings of the OSR community that you've seen people struggle with, or aphorisms which could be confusing if you don't understand the context? Even simple things like OSR ""turns"" being a period of time, it doesn't have to be big statement about the genre as a whole confusing people.",<praw.models.comment_forest.CommentForest object at 0x2b2b7a510>,osr,1738093803.0
1ife00w,Nostalgia is such a trap,"I bought the $5 pdf of the Village of Hommlet. I wish I hadn't, but I wouldn't have known that if I didn't buy it. I'm reading through it - or rather trying - because it's just so dense. It will in all seriousness require more notes than many college papers I've written. And, that isn't what bothers me. Gygax's prose has its charms and in the late seventies and early eighties I had a lot more time (being an adolescent with no responsibilities will do that for you). It's a product of the era after all.

No. What bothers me is that ANY modern adventure writing would follow that or even Keep on the Borderlands as a template. And, I say that with all love for Keep. Keep I've had for years and I have an almost intuitive index of its contents in my head at this point. But, I wanted to supplement that with the (in)famous Hommlet. **So, if anyone has a ""starting location"" sort of option that is written for actual use and play and not for Summer reading lists, or wants to share their own notes on Hommlet, I'm all ears.** I honestly don't know what I was expecting. I own G123 and D123. I know what Gygax's work typically looks and reads like. Nostalgia colored glasses get me again.

I'm reminded of why as a young DM I developed the ability to wing and improv as early as I did. It's because I wanted to run games not do homework. Anyway, end rant.

Edit: I appreciate most of you. I'll revisit it when I'm prepared to read Gygax rather than read a gameable product. It's really a testament to the quality of the phenomenon that was D&D that it survived the writing and edits of the day. Some of you though... have even more rose colored glasses than I have.

EDIT EDIT: Thanks for the support, folks. And the offers of notes, too! I'm going to complete this and I'll share my own notes; could be fun to compare notes and what different DMs took from the village! Hell, the process is part of the fun; it just isn't the fun I was expecting for some reason. I know it sounds like I'm talking smack about Gary, but I'm really not. His love of language was a HUGE influence on me and one of the things that kept me a voracious reader as a teenager. And, it's clear when you read anything he touched. But, we really can acknowledge that AND be critical. It's possible. If I can admit my own nostalgia goggles, so can you.

Anyway, Hommlet or BUST!",<praw.models.comment_forest.CommentForest object at 0x2b2ba4a40>,osr,1738437655.0
1hygwi3,"I rolled up 10,000 characters (so you don't have to) and only nine of them met the minimum ability cut-off to be Paladins.  Check my math","So I'm using OSRIC 2.2 3d6 flat with no Race Modification.  I guess Gary Gygax really wanted us to play more Magic Users because you have the highest probabilities (ca. 60%) to meet the minimum Abilities for either Cleric, Thief's or Magic User.  Fighters come in a litte lower at 58% chance and the other classes... well you're more likely to roll abilities that qualify you for nothing (ca. 14%)

[Distribution 10K 3d6](https://preview.redd.it/srw5xgf4t8ce1.png?width=735&format=png&auto=webp&s=3645123f1df395fb8f5c7a5c01eae15b81c7aaa6)

[Did I get this right?](https://preview.redd.it/umefxhd5t8ce1.png?width=590&format=png&auto=webp&s=f5f827c9f6d1fec396e8b596e7f01b307bbc27db)

[So you know I didn't cheat... the last 7 Characters \(Zero Paladins\)](https://preview.redd.it/ym5qhuo6t8ce1.png?width=558&format=png&auto=webp&s=87710f7d640200534a1e3a9c3913be1429e43a30)",<praw.models.comment_forest.CommentForest object at 0x2b2bced80>,osr,1736548227.0
