,title,selftext,comments,subreddit,created_utc
1i244h0,What's your OSR pet peeves/hot takes?,Come. Offer them upon the altar. Your hate pleases the Dark Master.,<praw.models.comment_forest.CommentForest object at 0x2af799460>,osr,1736965744.0
1jbcca3,Do you let the creator of a game influence whether or not you play/support it?,"I am an OD&D nerd and have enjoyed the recent publication from Wizards of the Coast about the original game. That sent me down a rabbit hole of retro-clones, I think they’re called. 

Al’Qadim was always my favorite 2nd Edition setting, so I was drawn to this obscure game I found called Seven Voyages of Zylarthen that is more swords and sandals than European fantasy. It reads like OD&D but, frankly, better in many respects. got some glowing reviews so I snagged it.

Yeah, it’s utterly brilliant. 

Unfortunately, I also found out in my wanderings that the creator is explicitly Islamophobic, or at least was when he was blogging many years ago. Seems like he has left the hobby. 

I want to champion a masterpiece of a game but struggle to separate art from artist, despite enjoying a game made by people as flawed and of their time as I certainly am in 2025. I also don’t want to attract the wrong kinds of people if I advertise games for it.

Has anyone run into this? Any advice? ",<praw.models.comment_forest.CommentForest object at 0x2af8672f0>,osr,1741981199.0
17fjy02,"Alexander Macris, the creator of Adventurer Conqueror King, is an active figure in the American alt-right movement. There are enough good B/X clones that one could buy without financially supporting the promotion of a hateful ideology.","I would have made this a reply to his kickstarter post but he has pre-emptively blocked users that were critical of him on this subreddit in order to keep the post as sycophantic as possible.

There's been an organized effort coordinated from the official Autarch discord server to jump on any comments in /r/osr that point this out, as well as to signal boost ACKS 2E prior to the kickstarter launch. The kickstarter post now on the front page was surely also shared there with the intent to generate early, non-endemic momentum. This behaviour is in violation of reddit's site-wide rules and in my opinion would warrant banning any and all Autarch/Arbiter of Worlds content from being promoted on this subreddit, a response many other subreddits have found effective against persistent brigading. This would have the added benefit of reducing the amount of transphobia and antisemitism on /r/osr, as those sentiments seem to inevitably pop up in comment chains about ACKS despite fans' insistence that the game has nothing to do with the politics of its creator.",<praw.models.comment_forest.CommentForest object at 0x2af991190>,osr,1698172836.0
1gy0xj3,Does the OSR community have a Nazi problem?,"I joined a local 0D&D group in my area and then left when I found out everyone at my table was a Neo-Nazi.

This was my first experience joining an OSR table so I figured I’d ask if this is common or not. Especially since there was a recent controversy with Questing Beast accepting a sponsorship from an alt-right publisher, I wonder how pervasive of an issue this is.

Edit: To clarify, they self identified as such. They weren’t just to the right of me. They didn’t just hold some racial prejudices and biases, they didn’t just support candidates I didn’t support. They actively like Hitler.",<praw.models.comment_forest.CommentForest object at 0x2afb1a6f0>,osr,1732372430.0
1j647sw,Does anyone else feel like the scene is getting stale?,"Not a rant, nor complaining, I’m trying to spark discussion. 

Does anyone else feel like the OSR scene is getting stale? I feel like I see way fewer blog posts nowadays, and that every recent product release is either:

1) A rehash of a game (often OSE or Mork Borg)we already have with a few house rules. 

2) An art piece masquerading as a TTRPG product. Utterly unusable at the table and only hood to look at. 

Maybe I’m just out of the loop but it seems like we’re getting so much less new and creative stuff nowadays. That’s not to say that there’s nothing new and creative (Crowns 2e is cool!), just that the days of endless truly creative stuff is gone. 

Truly, I fear that we have reached the end point of commercialization in our niche hobby. It is easier and more lucrative to appeal to TTRPG book collecters rather than TTRPG player, and thus we see more and more product focused at them. 

Or matbe I’m full of doom and gloom. Perhaps I have rose tinted glasses on for the past. I was not there after all, so perhaps I am mythologizing what came before. 

So like, are things getting more stale? Are they getting less interesting? Or am I just losing it?

Edit: I perhaps mispoke when I said ""end point of commercialization"". A better term would be ""logical conclusion of commercialization"" as in, this is where it makes sense we would end up. My apologies.",<praw.models.comment_forest.CommentForest object at 0x2afb8b2c0>,osr,1741392205.0
1flclzq,The new rule on AI is completely clear,"They said to not post low effort AI art and prose. As much as I'd like systems that use AI art in their products to be included in that, it's clearly not.

They just don't want people posting, ""I put 'Acid Wizard Sword' in to midjourney!"" x1000/day. Beyond that, say it with me: ""*Rulings, not rules*!""

The outrage is literally just whining by people who want to do exactly that because they're incapable of creating.",<praw.models.comment_forest.CommentForest object at 0x2afc23c20>,osr,1726840530.0
1j7t0zp,Was 5e originally considered a triumph for the old school?,"I was watching the interview between Ben Milton and Mike Mearls, and at one point, Ben mentioned that when 5e first launched, the OSR community initially saw it as a victory for their style of play—but over time, that perception soured.  

I wasn’t around the OSR at the time—I only discovered it after 2020—but that idea resonates with me. Even before I became disillusioned with 5e and moved toward OSR games, I remember 5e in 2014 feeling much closer to the experience I wanted. It wasn’t so much the original system that pushed me away, but how both the system and its community evolved over time. A Knight at the Opera [wrote a post that](https://knightattheopera.blogspot.com/2024/10/in-mouth-of-madness.html) really captured my feelings on this shift. Even now, I feel like I'd be happy to run a campaign using *Into the Unknown,* or even 2014 PHB-only with some hacks.  

So, for those who were active in the OSR back in 2014: Does Ben’s description of the community’s reaction sound accurate? If so, did the OSR community ultimately reject 5e because their initial reaction was inaccurate in ways that become more clear over time; or did the game start in a place that mostly aligned with OSR sensibilities before drifting away? Was it just a matter of ""that the gods it's not 4e""?",<praw.models.comment_forest.CommentForest object at 0x2afc7b710>,osr,1741590911.0
1i4wq5y,Running 5e showed me how much I love OSR principles,"I ran D&D5e for the first time in about 4 years last night, at a one-shot event for strangers hosted at a local cafe, and it was the most unwieldy, inelegant and unsatisfying GMing experience I’ve had in years.

I put a party of 4 Level 1 PCs through ‘Barrow of the Bone Blaggards’ by Necrotic Gnome because I know it pretty much off by heart. 5e’s lack of exploration procedures and dungeon turns, as well as how distinctly special and overpowered even a Level 1 party is, was infuriating. Darkvision, cantrips, and many class features just make it a complicated and poor situation.

However, by far the worst offender was the Skill system. I had to shut down players calling for their own skill checks: “You step carefully into the murky chamber-“ “Perception - 11, damn!” “Please, just let me finish and roll when I ask you to.” The players constantly insisted on contextualising everything from the myriad numbers on their sheets as opposed to making in-universe decisions.

The players had a good time, and I didn’t show my frustrations, but it was so disappointing that they couldn’t get the full experience due to the leeway given by a bloated and weak system.

I’ve never felt more vindicated that the OSR/NSR/rules-light space is the place for me. I’ll be sticking with my staples of Cairn, OSE, Vaults of Vaarn, X-Borgs, Into the Odd, and Mothership from now on!",<praw.models.comment_forest.CommentForest object at 0x2afcde660>,osr,1737287114.0
1jc708w,Is LotFP just a dead release at this point?,"I dusted off my copy and looked at it a second ago. Then remembered there was supposed to be a GM book. This isn't including the grindhouse version. But an ""expanded"" version as per the DMsguild blurb. 

Ive been out of the loop for a while now. Just curious. I looked through the sub and couldn't find much. Maybe I'm missing something 

Edit: ill just read about the names surrounding the game. Might be the thing I'm missing haha thanks guys! ",<praw.models.comment_forest.CommentForest object at 0x2afd567e0>,osr,1742078144.0
109p0gm,Frog God Games says no to WotC,,<praw.models.comment_forest.CommentForest object at 0x2aff09d90>,osr,1673494155.0
1jb018f,What's the point of having so many classes and races?,"I'm new to this RPG universe, but one thing that bothers me about most modern games is the number of races and classes. But why did so many variations and options be created? Is it just for commercial purposes, because it sells more?

I say this thinking about OSE advanced, Shadowdark, Dnd 5e...",<praw.models.comment_forest.CommentForest object at 0x2aff5fa10>,osr,1741944903.0
1grfqzx,What is the Red Room?,Watching the latest Questing Beast video and they’re in the comments whinging at people. What’s their deal?,<praw.models.comment_forest.CommentForest object at 0x2b0806d50>,osr,1731619611.0
1fk2xgd,What are your top 3 OSR games? (2024 update),"Two years ago there was a post here on the OSR subreddit with the exact same title as this one (sans parentheses).  Lots of people submitted three choices, which were compiled in a Google Doc.  The results, when ordered and ranked based on how often they were picked, gave a really interesting insight into the play culture here (you can find them linked at the bottom).

Well it's been (almost exactly) two years since that previous post.  Two years of an OGL scandal, a deluge of great new games, and the slow ever moving treads of play culture zeitgeist.  I would love to see what has changed since September 2022 and was hoping for responses to help recreate this poll:

**Can you denote your top three OSR TTRPGs?  They can be your ""Top""/""Favorite""/""Best"" (etc.) games for any reason.  Order doesn't matter, as each of your three submissions will be counted once.**

Here are my top three.

* Basic Fantasy
* Vaults of Vaarn
* Shadowdark

I will compile all the votes here into a Google Doc  
Edit: The data is here, but I want to clean it up a bit before sharing it as a separate post in this subreddit.  Feel free to look at the data though:  
[https://docs.google.com/spreadsheets/d/1n1E157M1irKzPRXeQJYUQJ1fpD4zLr1HcZCMnxa-GP8/edit?usp=sharing](https://docs.google.com/spreadsheets/d/1n1E157M1irKzPRXeQJYUQJ1fpD4zLr1HcZCMnxa-GP8/edit?usp=sharing)

(The old post can be seen here [**https://www.reddit.com/r/osr/comments/xevdkh/what\_are\_your\_top\_3\_osr\_games/**](https://www.reddit.com/r/osr/comments/xevdkh/what_are_your_top_3_osr_games/) and the original compilation Google Doc can be read here [https://docs.google.com/spreadsheets/d/1xogJZg6tMOS1IuLutrc7RdIWsRBdNDMarhNJ9iDshLA/edit?usp=sharing](https://docs.google.com/spreadsheets/d/1xogJZg6tMOS1IuLutrc7RdIWsRBdNDMarhNJ9iDshLA/edit?usp=sharing) )",<praw.models.comment_forest.CommentForest object at 0x2b08c2390>,osr,1726691706.0
1jezkmd,My players won't stop collecting teeth,"In our Mausritter campaign, I'd created a wizard's tower inhabited by a necromancer obsessed with teeth. He went by The Dentomancer. The Dentomancer made an offhand comment about bring willing to buy teeth off of them, and wasn't really interested in anything besides teeth. It was a hook for a sidequest, nothing more really. 

** I was a fool. **

What I thought was just a fun detail became a goal for one of my players. In his mind, teeth = gold = xp. Teeth have become a complex mechanic with numerous details and caveats. Each time he kills a creature he wants to know the monetary value of their teeth, spends time taking the teeth out of corpses, and asking if any creatures have unique teeth. 

This idea had spread to the rest of my players. They will often choose to engage in combat based solely off of tooth quantity and quality. I've had to Google the number of teeth for real life creatures pretty consistently, and there are now special teeth encumbrance rules. Each new type of tooth results in a new ruling. I'm a big believer in ""rulings not rules"" but they are pushing that philosophy to its limit. It has been six months of consistently tooth-based gameplay. 

The thing is the players have yet to return to the Dentomancer to cash in their teeth. I don't know what will happen when they do. It's not really that big a deal but I wish I had a real solution for this. What should I do?



TL;DR: My Mausritter players have become obsessed with collecting teeth for money, to the point it has become a significant mechanic. ",<praw.models.comment_forest.CommentForest object at 0x2b08e9eb0>,osr,1742397906.0
184peia,PSA: LotFP has sexual violence built into the core rules,"Lamentations of the Flame Princess has >!rape, genital mutilation!< and sexual violence built into the core rules/mechanics, in the random tables in the ""Summon"" spell. Following Rules as Written, you may be ""forced"" (or at least asked) to roleplay through these acts of sexual violence.

Why post this PSA? I believe, due to the nature of sexual violence and its affect on people and society, that anything containing sexual violence should be clearly labeled as such. Especially with RPG's, where you might be asked to role-play through sexual violence, I believe that it needs to be explicitly cleared with everyone involved.

I regularly see people recommending LotFP along side Basic Fantyasy RPG, OSE, Swords & Wizardry, etc, without making it clear that LotFP has these components of sexual violence built into its core rules, and the others do not. I think a lot of people must not be aware of this, and so I'm posting this so people are aware and can make their own decisions fully informed. Again, this is not just part of the setting of LotFP, it is part of the Core Rules.

For me, it's important that I can hand a player or potential player the ""Core Rulebook"" or ""Players Handbook"" and NOT have them exposed to descriptions of >!rape or genital mutilation!<. I have friends that have been >!raped, and some that have been molested as children!<, and these kinds of descriptions and reminders are traumatizing to them. So it's important to me that they are clearly labeled.

LotFP states ""18+ Explicit Content"", but I'm guessing most people (including me), expect it to mean more ""sexual content and innuendo"" and less ""sexual violence"". I wish Raggi was more clear about what is meant by ""18+ Explicit Content"".

Just to be clear, in order to trigger these mechanics you need to have a character cast the spell ""Summon"", fail a check or two, and then roll just right on the random tables for the spell. There is a good chance most people playing LotFP have never seen these mechanics in action. Also, as a side note, the ""Summon"" spell encourages human sacrifice, in that it will provide a bonus to the caster for some of the random rolls.

The section in question is in the free ""LotFP Weird Fantasy Role-Playing - Player Core Book:Rules & Magic"" (file name LotFPRulesMagicFreeNoArt.pdf)? Here is a quote from that pdf, from under the Summon spell in the Spell Descriptions (pages 134-143, the exact quote coming from pages 141-142 in the subsection 6:""Lust of a Betrayed Lover""):

""All characters within the local area (to be deter- mined by the situation) roll 1d6. Those that roll a 1 are at fault for the situation. All characters not at fault will become allies in the drive to hunt down, subdue, >!and mutilate the genitals !<of all who are at fault. After this is done, all who are not at fault must make a saving throw versus Magic. Those who fail will seek to kill the parties at fault, and all who stand in their way of doing so. The effect ends only when all of the characters at fault have been dealt with, although they will not be hostile with any of the characters present who are not at fault , even if they were hostile or longtime enemies before Summon was cast. If nobody is at fault, then things will get ugly. All characters become obsessed and fixated on one random other character in the vicinity, and >!will attempt to have sex with that character!<—at any cost. The character will first attempt to subdue the subject of his obsession, to unconscious if he can or death if he must, before>! having his way!<. Male- female pairings will result in conception, and 10% of male-male pairings will as well. The offspring will be an otherworldly creature—use these Summon charts to determine exactly what, assuming a 1 HD creature—which will do>! 1d10 damage to a woman carrying it as it is born, 2d10 to a man!<. The effect ends for a character when >!his lust is sated!<.""

It currently is linked from [lotfp.com](https://lotfp.com) and is on DriveThruRPG

Edit: I kind of feel like those who are saying ""It's LotFP and Raggi - It should be obvious what it's going to contain"" are being purposefully obtuse. I wouldn't be surprised if LotFP is in the top 20 OSR games recommended by people on this site - but it's the ONLY game commonly recommended that contains any sexual violence in the core rules. Hence this PSA post.

Edit 2: I really dislike moralizing regarding violence in games, because I feel it leads to silly and pointless quagmires. That said, there are real world scenarios where violence can have a  pragmatic purpose. For instance, defending ones family from a murderer, or defending your country from a conquering force. But there is never a scenario where sexual violence is pragmatic - it is always sadistic, meant to tear down, subvert, violate and destroy. That is why it's treated differently.

Edit 3: This post got way more attention than I expected. I want to make it clear, I am opposed to censorship and support Freedom of Speech. This wasn't a ""call to action"", but if I was going to make a suggestion or request, it would be that when you recommend LotFP, include a warning that it contains sexual violence. You can link to this post if you want.

Anyway, I'm done here for now. This post is way too long. I'm going to spend my time on things more enjoyable, like looking at the newest settings and OSE adaptations!",<praw.models.comment_forest.CommentForest object at 0x2b0a1df40>,osr,1701044211.0
1j1fjdv,Why I joined,"The community’s reaction to the EGG Jr post. 
I hope to be able to contribute to a community that doesn’t permit his ilk to get away with their shit.
I’d’ve posted in that thread, but couldn’t. Sorry for the new one.",<praw.models.comment_forest.CommentForest object at 0x2b0a64680>,osr,1740879539.0
1i2ry0c,What campaign setting are you playing in in 2025,"New Year, new post for world settings, which are you running games / playing in in the new year?",<praw.models.comment_forest.CommentForest object at 0x2b0ac6660>,osr,1737042715.0
1irgztc,What game needs a retroclone that doesnt' have one?,"My vote on this would be for *GURPS.*  Much as I love *GURPS* 4th edition, SJG is not really very keen on people making and selling supplements for it, other than through them.  *GURPS* is also literally an old school game: the first 3 editions came out in the 1980s, and the 4th edition is almost as compatible with 3rd edition as AD&D 2e was with 1e. If *GURPS* had a retroclone, it could function in the same way as *OSRIC* does for 1e.

Any other games that would benefit from a retroclone that don't have one?",<praw.models.comment_forest.CommentForest object at 0x2b0b1eea0>,osr,1739788501.0
1i3txi7,The Satanic Panic Still Baffles Me,"Context to The 700 Club and the Satanic Panic: [here](https://knightsdigest.com/what-was-the-700-club-during-the-satanic-panic/)

The Satanic Panic was peak brainrot. Somehow, a whole generation got convinced Dungeons & Dragons was a gateway to Satanism, thanks to shows like *The 700 Club* screaming about devil worship and spiritual corruption. Parents burned books and dice, cops treated gamers like cult leaders, and movies like *Mazes and Monsters* made everyone think rolling dice meant losing your mind. Over 12,000 cases of “Satanic Ritual Abuse” were reported, and guess what? Not a shred of real evidence. Just vibes and fear. Looking back, it’s wild that a board game could freak people out this much, but hey, 80s brainrot hits different.",<praw.models.comment_forest.CommentForest object at 0x2b0b6c830>,osr,1737156606.0
1ih3zx6,"One of my players (magic-user) has subtly complained about not being able to do anything and feeling useless, how should I address this?","So, first off, he's playing a Magician in a Dolmenwood campaign, he just hit level 4. I keep telling him there will eventually be a payoff, but we've gone through 1 large dungeon and 3 small ones at this point. Dude is a great friend of mine since childhood, there is absolutely no interpersonal conflict between us. This is not a ""talk to your player"" problem.

Here's some things I've heard him say or mention recently:

""I'm a magic-user, so I can't do anything this round.""

""I would use a spell here, but I don't know any, and we should save it for Sleep anyway.""

""I'm not even going to throw a rock because I have like a -4 to hit.""

""Being a magic-user is objectively worse than being a wizard in modern systems. There's no cantrips, but it's still somewhat satisfying to sleep a horde of enemies. It just rarely happens.""

And so on. I should mention, he does like the OSR playstyle, completely gets it, and he knows he has to think creatively. But I think he sometimes just wants to blast monsters, ya know? And sitting there watching the fighter run up and 1v1 tough foes while the cleric incinerates a horde of skeletons with turn undead... Yeah, I can kinda see why.

And to address some of his problems, he *has* found plenty of spells to learn, but most are situational, and he's always under the assumption Sleep is better so he's afraid to use up any slots. 

He is a Breggle, and can use his horns to attack which are better than any weapon he can use, but he is playing it smart and safe and does not get into any melee combat.

Basically I am looking for suggestions on how to handle this perceived imbalance (I am aware this is the nature of being a MU). But at the same time, I just want him to have more fun. 

Should I let him learn a cantrip? Give him magic rod which can cast a cantrip? How would I even go about designing a basic cantrip? Save vs. Spells or take 1d4 damage? 

And for what it's worth, I have allowed him to change classes, but he wants to commit to MU. I think he's trying to power through it. 

Any ideas would be really appreciated!",<praw.models.comment_forest.CommentForest object at 0x2b0bc0350>,osr,1738626832.0
17nefmm,RE: Subreddit Rule Changes - Blacklisted Creators,"[For those who have not seen it](https://www.reddit.com/r/rpg/comments/17mz4v5/subreddit_rule_changes_blacklisted_creators/), /r/rpg has made a post creating a change to their rules.

Here in OSR we have had a very similar, if not identical experience relating to Alexander Macris and what can probably be most accurately described as a bad faith brigade driven marketing campaign. /r/osr will be joining /r/rpg in transitioning our No Zak S rule, into a rule relating to blacklisted creators. To quote /u/PrimarchtheMage ""This includes Adventurer Conqueror King System (ACKS), Ascendant superhero RPG, and Autarch studios"". Our position is that all promotion and marketing on the subreddit should be for the good of the /r/osr community and as a subreddit we are opting out of these products and their community and or creator behavior and activities.

[There are options for blacklisted creators to advertise their products through reddit.](https://www.redditforbusiness.com/advertise)

This thread will be exempt from this particular rule for the purpose of relevant feedback. Fair warning that Zak S will still still trigger automod. We will restore the ones automod holds, but we cannot always be available to do it every moment of the day. Thank you for your patience if waiting for one of these held posts to be restored. This is your fair warning. Threads that devolve into fighting or other rule breaking will be locked or otherwise moderated.",<praw.models.comment_forest.CommentForest object at 0x2b0d128d0>,osr,1699074184.0
1eoxynn,Shadowdark. What am I Missing?,"Shadowdark is getting pretty popular. It won Product of the Year at the Ennies. But when I look it over, it just seems like another standard OSR game. Other than the real time torch mechanic (which can be added to any other game), I don’t see anything really exciting. I’m not putting it down, my assumption is that I am missing something. So, what am I missing about Shadowdark? ",<praw.models.comment_forest.CommentForest object at 0x2b0d78ec0>,osr,1723309462.0
