,title,selftext,comments,subreddit,created_utc
1hx8p37,Rolling for hit points... why?,"I'm very much for the idea of making characters with no real vision, rolling 3d6 in order, and seeing what you get. I'm very much for not fudging and letting it play out. What I've never really gotten is rolling for hit points.

People have had this discussion for decades, so I won't relitigate anything. In short, I just don't even get why it's (still) a thing. What would you lose if you just used a table that told you how many hit points you had based on your class and level, modified by Constitution? I'm not sure hit points are so dynamic a thing that having them be largely randomized is that desirable. 

That way, you avoid randomness taking away class niches (such as the 1st level Thief rolling higher hit points than the Fighter), 1st level one hitpoint wonders, and people getting screwed by RNG. Plus, I think wildly varying hit points can result in characters doing strange things for entail reasons, such as a high strength 1st level Fighter avoiding melee combat because their hit points are really low.

Obviously, the standard method has been used for decades, so it works. I guess averages do tend to work out; statistical anomalies on the low side will be weeded out most of the time and replaced with characters with better hit point rolls (and if not, subsequent levels should get them to normal). Plus, it can be worked around; a hut point crippled 1st level Fighter could just focus on ranged combat and avoid melee combat.

Overall, though, I'm just not sure hit points benefit from randomness. I think it can unnecessarily cripple characters while adding a weird meta element with little in-game basis. I'm not opposed to randomized advancement (I love Fire Emblem); I just think it's odd to only have hit points advance randomly, and not to hit chance, spell slots, saving throws, etc too.

I'm definitely open to having my mind changed, though. ",<praw.models.comment_forest.CommentForest object at 0x2b421ac00>,osr,1736412897.0
1ch10h8,What is the draw of OSR?,"So I see a lot of posts that take unkindly to newer versions of D&D (or similar games).  But I’ve never really gotten a clear answer as to why, or what about OSR people enjoy so much more.

So was hoping this post could help enlighten me on the pros (and cons).


I’m hoping this is more than just a “I grew up with X, so only X is good” mindset thing.",<praw.models.comment_forest.CommentForest object at 0x2b427e8a0>,osr,1714504279.0
1hu8ltu,"If the encounter is balanced, runaway!","I always hear about the DMs worrying about creating balance encounters. 

And to this I always respond ""in 5e a balanced encounter is when will you kill all the monsters before any of the PCS die"". In osr a balanced encounter is when you kill the monsters before all the PCs die.

In other words a balanced encounter is equal to a fair fight. And it would be foolish to engage in a fight to the death that your party has equal odds of losing. At best one or two of you might survive.

What you really want is a fight of overwhelming odds when you kill all the monsters before any of you die but that is hardly balanced.

far more important than creating a ""balanced"" encounter is telegraphing to your players the difficulty of the encounter so they can decide whether and how to engage with it.

I share a few ideas on how to do that in my blog post. 

https://thefieldsweknow.blogspot.com/2025/01/designing-encounters-for-osr-myth-of.html",<praw.models.comment_forest.CommentForest object at 0x2b42acad0>,osr,1736088613.0
vle5ys,What is your unpopular OSR opinion?,"What is something that is generally accepted and/or beloved in the OSR community that you, personally, disagree with? I guess I'm asking more about actually gameplay vs aesthetics.

For example, MY unpopular opinion is that while maps are awesome, I find that *mapping* is laborious, can detract from immersion, and bogs down game play.",<praw.models.comment_forest.CommentForest object at 0x2b44e39e0>,osr,1656276783.0
1g5x2te,Do you think encumbrance is that important?,"So the majority of my game background is 5e and we literally always ignored encumbrance (the game was already so slow I couldn't beat slowing it more)

My group finally soured on 5e and I have finally gotten them to make the jump to B/X mostly. I really didn't bother with carry weight at first but then the players started just having absurd amounts of coin (and XP) because they could just leave dungeons with everything. (I was also doing some other things wrong as well that I believe contributed to this)

I started using all the bag capacities in OSE but now I've just sort of settled on strength score times 100.I really haven't made the jump to items yet. I don't think I'm going to either I find tracking coins a bother already.

So my question I suppose is, how strict are your encumbrance rules? What is the trade off? Do you even care about encumbrance?

Edit: I should specify, I don't really care if it's a b/x perspective as well. I'm kicking around a few other OSR systems so I'm interested in alot of ideas
",<praw.models.comment_forest.CommentForest object at 0x2b4519f10>,osr,1729187891.0
1j0a3ql,OSR and ADHD,"Does anyone get into running a campaign with a group, and then really struggling to get more that 20+ sessions into it before the next shiny campaign idea comes along?",<praw.models.comment_forest.CommentForest object at 0x2b453f200>,osr,1740756081.0
1i8do87,Old School Essentials -- Motivating Players to Keep Retainer Alive,"I've run into a problem in my OSE games. The mechanics of the game incentivize the players to get the retainers killed in the dungeon so they don't have to pay them a share of the treasure, so the PCs get to keep all the gold and XP for themselves. Now, they haven't been murderous bastards and slit the retainers throats or anything, but I still feel like it creates a narrative problem when the main characters just keep grinding through hired help. How can I get the game to encourage them to keep retainers alive?

The first thing I've tried is making them essentially post a bond on the retainers life of 50 gp per level. They post it with some local authority, and get it back if the retainer comes back alive. If they die, it goes to their next of kin. But as they started to get more and more gold as they leveled up, this became a non-issue. I could adjust the price in future.

Or perhaps the retainers could still earn their share for their families, even if they die. This is a bit harder to justify, since they're not doing any work once dead.

What other things have you folks done to encourage keeping retainers alive?",<praw.models.comment_forest.CommentForest object at 0x2b455e180>,osr,1737665478.0
1iviheq,not-so-mega-dungeon?,"I'm keen at some point in the future to run The Halls of Arden Vul - but right now it's seems a pretty huge task!

What are some dungeons that are smaller (but not tiny) that might be a good practise for running something larger eventually??

An extra bonus would be if I could slot it somewhere in Dolmenwood (I'm sure I can figure that out though.)

Thanks!",<praw.models.comment_forest.CommentForest object at 0x2b457f590>,osr,1740230132.0
1ismqxn,"Your players are traveling in a snowy forest, what do you do?","In a medieval fantasy setting. Let's say your players rescued someone that was trapped in a cave, the person are okay with no injures and now the party is: 3 new adventurers and the person that got rescued.

They are in a forest covered in snow surrounded by mountains, they need to go to the nearest village that requires 2 days of traveling by foot. 

Before entering the cave, they killed a bear that was nearby to prevent the bear from attacking then in the future.

As a GM, what do you do? I'm a new DM and my last session ended this way, I'm looking for some ideas about what to do.

Thanks for the attention!!",<praw.models.comment_forest.CommentForest object at 0x2b4592720>,osr,1739910512.0
1icoud7,Why did D&D buy a needleworking company in the 80s?,"Apparently TSR bought ""Greenfield Needlewomen"" in the very early 80s, and within a year or so had to write off the entire acquisition price as a failure.

Does anyone know the story behind this?",<praw.models.comment_forest.CommentForest object at 0x2b45b7320>,osr,1738137300.0
1j5k9f6,"[PSA] Massive print cost increase coming to DriveThruRPG effective April 1, 2025","[DriveThruRPG](https://preview.drivethrurpg.com/en/browse?ffiliate_id=2150725) and associated sites will soon increase cost of print-on-demand products from 10% to 80%, depending on print binding and location:

**EDIT: UPDATED ANNOUNCEMENT**

***Upcoming Print-on-Demand Book Price Changes – Effective April 1, 2025***

*We always want to keep print costs as low as possible, and it has been years since we passed any price increases through to our publishing partners.*

*However, our print supplier, Lightning Source/Ingram, has announced a price adjustment starting April 1, 2025, that will be reflected on DriveThru sites.*

***Key Changes***

* _Due to increasing supply costs in the US, **Black & White print costs in the US will increase significantly**, from around 20% for low-pagecount hardcover titles up to about 50% or slightly more for large hardcover books, and with softcover titles seeing an even greater increase._
* _**UK print costs for Black & White books will also increase**, but generally only by 3-4%._
* _**Standard Color print costs will increase**, by roughly 12-13% for US printing but only around 3% for UK printing._
* _On the whole, **Premium Color print costs will decrease slightly for US printing but increase slightly for UK printing.**_
     * _Example 1: A 180-page large premium hardcover currently costs $32.10 to print in the US; after April 1, that same title will drop to $27.80._
     * _Example 2: In the UK, the same 180-page book currently costs £20.23, which will increase to £20.93 starting in April._

Above will most likely lead to publishers increasing prices on the books, especially those who use at-cost pricing. I ordered all hardbacks from my wish-list, just in case. :)

**EDIT: PREVIOUS ANNOUNCEMENT**

***Upcoming Print-on-Demand Book Price Changes – Effective April 1, 2025***

*We always want to keep print costs as low as possible, and it has been years since we passed any price increases through to our publishing partners.*

*However, our print supplier, Lightning Source/Ingram, has announced a price adjustment starting April 1, 2025, that will be reflected on DriveThru sites.*

***Key Changes***

* _Due to increasing supply costs in the US, **Black & White print costs in the US will increase significantly**, from around 10 percent for low-page count hardcover titles up to about 40+ percent for large hardcover books, and with softcover titles seeing the largest increase._
   * _**NOTE**: In some cases, Black & White books printed in the US may actually cost slightly more with this change than standard color books of the same size and format._
* _**UK print costs for Black & White books will also increase**, but generally only by 3 to 4 percent._
* _**Standard Color print costs will remain nearly unchanged**, with some books beyond a certain page count actually seeing a slight decrease._
* _On the whole, **Premium Color print costs will decrease slightly for US printing but increase slightly for UK printing.**_
   * _Example 1: A 180-page large hardcover currently costs $23.75 to print in the US; after April 1, that same title will drop to $20.57._
   * _Example 2: In the UK, the same 180-page book currently costs £14.97, which will increase to £15.49 starting in April._",<praw.models.comment_forest.CommentForest object at 0x2b45ca0c0>,osr,1741342265.0
1f3lt5u,Has Shadowdark basically taken over the YouTube algorithm?,Not long ago it seemed some content creators on YouTube I liked were hyping Shadowdark.  Has it taken over your YouTube as well? Hoping to get it some day.,<praw.models.comment_forest.CommentForest object at 0x2b4614d70>,osr,1724882507.0
1ixdxix,Give me OSR concepts world builders should address,"The title. Assuming the baseline fantasy or fiction is something between OD&D, BECMI and B/X, Im trying to come up with a list of concepts and questions that if you're writing for an implied setting, what are conceptual blind spots that need to be addressed and accounted for?

A couple of examples:

If you have a Catholic-esque religious organization, how do they politically view direct but magical (may include clerical, but assumed arcane) healing?

Specifically, who makes magic swords/armor/potions? What is the exact process of making them?

If a legal organization, such as a the city guard, acquires a wizard's spell book, what typically happens to it?

(Just about any question about most Monster Manual creatures)

Im not asking for answers to these questions. Only additional questions to answer for writers and worldbuilders to answer ourselves. ",<praw.models.comment_forest.CommentForest object at 0x2b4635820>,osr,1740433464.0
1ioyxjm,Something I’ve noticed lately rant…," It seems for all our bragging about “problem solving” people seem to play everything like a video game these days. The OSR community likes to say “hey we dont have a bunch of gizmos and powers you gotta use your noggin” and then proceed to close the gap and melee melee melee and nothing else during battle or say “ I search for traps” and nothing else, as if that wasnt the most vague statement on earth. Ive been running games for 15 years, and sadly this inadvertent human experiment has shown me most people just dont really think creatively so why brag about it? You might be saying “ Hey change your encounters so they have to be more intriguing” even then, people get frustrated and just fuss, negotiate and scheme to close the gap and bonk (for the combat example). So why this chip on the shoulder that our dungeons are cooler if you have GMs playing boring RAW crap and not awarding creative play? 

Maybe I keep finding sucky players and Im a total tyrant and youre criticizing me in your head, Im ready to believe that. I always think of how Bender used the fire spell to create steam and escape in that one special, thats the kinda play we should praise above all else, not “Uhhhh the dragon saw you anyway that was dumb and did nothing”. It breeds power players and nervous nellys who never want anything more than to stay alive, which translates to - I wanna do max damage with the best thing i have- and any other form of conquering the challenge proves useless or punishable to the character. Players miss clues, nuance and even magic items cause they have this go go go power player attitude even in OSR circles at times. 

Granted many times I have had groups that are definitely super clever, but so many times I feel like people have Covid IPad kid brain now and roleplay like a bag of rocks.

Rant over. 

Edit: this is something Im seeing in VTT more than anywhere even if OSR, as one commenter mentioned that may be why.  * Shrug* back to going outside to find game then.",<praw.models.comment_forest.CommentForest object at 0x2b4657950>,osr,1739495714.0
1hr9zdc,What are your goals for the hobby this year? ,"Just interested in the projects, trends, games, systems, modules, and other stuff people are going to be diving into this year.  Personally, I plan on:

Perfecting my Mass Combat rules for OSE.

Finishing my two campaigns (Through the Valley of the Manticore/ In the Shadow of Tower Silveraxe) and merging the two groups MMO style into Scourge of the Northland mega-campaign.  

Play-testing my OSE inspired cyberpunk TTRPG. 

Modeling/crafting

Introducing my 6 yo son to the hobby.  Teaching him the ways of the forever GM.  

Good luck to you all in 2025!  

Edit: Thank you for all the responses and enthusiasm.  Very motivated to see so many people ready to kick the door down to 2025 and unleash some OSR madness.  Get these projects done!  Play these games!  No excuses!  No mercy! Happy New Year!  ",<praw.models.comment_forest.CommentForest object at 0x2b467b470>,osr,1735758757.0
1fclyor,When is the OSR not rules-lite?,"Often OSR becomes synonym of rules lite game, but I guess that doesn't have to be the case. 

What OSR game do you know that have a lot of crunch? (In a scale where OSE is medium crunch and Knave low crunch)",<praw.models.comment_forest.CommentForest object at 0x2b46d1880>,osr,1725876907.0
1izbe23,What's the best adventure for learning how to run OSR properly as a GM?,"I've played some OSR adventures like *Hole in the Oak* (OSE) and *Keep on the Borderlands* (BX), but I'm looking for an adventure that actively teaches the **principles of OSR play** to the **GM**, not just providing rooms, encounters, and ideas.

For example, one key OSR principle is *telegraphing danger*—if there's a room full of small broken skeleton pieces and the players want to sneak in, they should be given enough clues to realize stepping inside might make noise. I want an adventure that explains these kinds of responses, rather than just listing what's in each room.

I understand that for many people who've been playing D&D for a long time, especially older editions, this might not seem very useful—they already know and understand these principles because it's how they’ve always played. But for newer players who are just getting into the OSR style, do you know of any adventures that **explicitly** teach the GM how to handle player agency, telegraph threats, and respond dynamically, rather than just presenting a dungeon and expecting you to already know how to run it OSR-style?",<praw.models.comment_forest.CommentForest object at 0x2b46f99a0>,osr,1740646143.0
1gzq9sg,Ways to handle not dying immediately at 0 HP?,"What are some good ways to handle not dying immediately at 0 HP? 

I want to be able to throw really dangerous stuff at players, like fireballs and ogres and so on, but death at 0 HP is rough. Perhaps have characters go unconscious with negative HP? Perhaps allow a death save (success means knocked unconscious, otherwise dead)? Or perhaps any time you reach 0 HP or take damage at 0 HP you must make a death save to stay conscious or die on a failure? Or maybe you have some other ideas entirely? I want the grit and danger of instant death at 0 HP but a bit less harsh. All ideas are welcome! This is a brainstorming post. ",<praw.models.comment_forest.CommentForest object at 0x2b47308f0>,osr,1732560071.0
103egk2,Can We Change Our Reputation? OSR is Not About Bigotry,"Traditionalism and bigotry of all kinds are prolific in the OSR. That's sick and needs to change. But as long as those outside the OSR portray us as universally bigoted, marginalized people will avoid our spaces. That means the bigots win.  

PBS recently published an [article](https://www.pbs.org/newshour/arts/how-a-new-generation-of-gamers-is-pushing-for-inclusivity-beyond-the-table) about diversity in tabletop RPGs. It's a fantastic article except for one detail: they say that the OSR is *about* preserving the ""white masculine worldview"". That's all that's said. They don't even expand the acronym. (EDIT: they actually did expand the acronym, I just forgot apparently) 

Thousands of people will read this article and all they'll know about are the bigots. This perception has got to change.  

We need people to see the progressive side of this community. We need people to see the bipoc, queer, and women members of this community. 

I'm a queer white man, and a boilerplate leftist. I want more diversity in our games and among our players. I know I'm not the only white man here who wants that. More importantly, I know that diversity *already exists* here. 

I'm going to [email](https://www.pbs.org/newshour/about/contact-us) PBS asking for a correction. I want to give them a showcase of the diversity and forward-thinking people in the OSR. If that's you, please comment with your perspective, with links to blogs and games.",<praw.models.comment_forest.CommentForest object at 0x2b47feea0>,osr,1672865035.0
1hnpujr,Can I use 5e to run an OSR megadungeon like Stonehell?,"I'm interested in running Stonehell. Assuming I port over the B/X dungeon crawl turn structure, wandering monsters, reaction rolls and (somehow) morale rolls... Does D&D 5th edition work as a ""proper"" dungeon crawler? 

Realistically, I'm probably going to use B/X, or try Shadowdark... but still, I know my players are very attached to 5e, and if it could work for Stonehell, I might as well try, right? Heres my concerns:

Do the plethora of player abilities, the high player survivability, and the ""bag of HP"" monster design, make the game take too long? I know a lot of combat in 5e takes ages, and i'd worry that you wouldn't get enough done in the dungeon to make a session feel satisfying.

Also, do you think the existence of skills would detract from the more improv and freeform gamestyle of the OSR? Would it just reduce the ""experience"" of dungeon crawling to a bunch of skill checks?

Do the existence of ""every race except humans has darkvision"" and ""every caster free and infinite light cantrips"" throw off the feel of the game?

  
Does anyone have any experience running megadungeons with the OSR vibe, but using 5e?

Thanks.",<praw.models.comment_forest.CommentForest object at 0x2b4821b20>,osr,1735335980.0
1eqjtny,"His Majesty the Worm: tarot-driven, slice-of-life megadungeon exploration","Hello!

For the past 8 years, I've been working on a game called **_His Majesty the Worm_**.

# What is His Majesty the Worm?

*His Majesty the Worm* is a new-school game with old-school sensibilities: the classic megadungeon experience given fresh life through a focus on the mundanities and small moments of daily life inside the dungeon.

* **Food, hunger, light,** and **inventory management** are central to play and actually fun.

* **Tarot cards** are used to create an action-packed combat system that ensures that all players have interesting choices every minute of combat: no downtime!

* The game has **robust procedures.** Adventure in the Underworld, rest in roleplaying-driven camping scenes, and plot long-term schemes in the City at the center of the Wide World.

* The relationships between companions, called **Bonds,** powers the rest and recovery mechanic of the game. The game centers the human element. 

The game is intended for a traditional setup between a single GM and 3-6 players. It emphasizes long-term, Metroidvania-like play. Tarot cards are used as a randomizing element. If you like things like _Dungeon Meshi_ or _Rat Queens_, you might find something fun in this game.

**You can learn more about the game, and find links to buy either the physical or digital editions, [on our website](https://www.hismajestytheworm.games/)!**

(When it launched, the physical edition sold out within 3 hours. The books are now restocked at Exalted Funeral!) 


# Want a preview?
Read four sample chapters (over 100 pages of content), learn more about the game's eight-year development, and dig into game design devlogs at our [Itch page](https://riseupcomus.itch.io/his-majesty-the-worm#:~:text=for%20OSR%20games-,Want%20a%20preview%3F,-His%20Majesty%20the)! 

---

Happy to answer questions, and thanks for your attention and consideration!",<praw.models.comment_forest.CommentForest object at 0x2b484f4d0>,osr,1723483784.0
1hgqz46,is basic fantasy roleplaying game good if i like 5e but want a lighter game?,"pretty much my title!!! i like the vibe and feeling of 5e d&d where it's kinda heroic and high fantasy with lots of magic, but i just feel quite drained/tired after dming a session of it and i notice we seem to have rules arguments we dont have when i dm other games like call of cthulhu!!! so i've been trying to look at other fantasy rpgs instead but i feel so overwhelmed by all the choice!! 

is basic fantasy rpg a good choice for me? or does anyone have other recommendations!!! 

edit: THANK YOU for all the suggestions everyone!!! i really appreciate it!!!",<praw.models.comment_forest.CommentForest object at 0x2b4872b70>,osr,1734487027.0
